Text,Title,Publisher,Relevant,Stance
Viie meetri pikkust alumiiniumkerega politseisedaani turvavad pättide eest lisaks nii auto lähiümbrust kui ka sõitjateruumi pidevalt jälgivad turvakaamerad ( loomulikult öövaatlusseadmega ) ning sõrmejäljelugejaga käivitustõkis.,Seda autot pätid kardaksid !,Õhtuleht Kirjastus,Yes,Neutral
"Viimase aja skandaalid PPAs, alates korruptsioonist kuni ametialase läbipõlemiseni, on murelikuks teinud nii poliitikud kui ka kodanikud.",Tähelepanekuid sündmuste arengust PPAs,muud,Yes,Negative
Viimasel ajal on politsei näidanud üles suurt oskust rahvahulkade ohjeldamisel suurüritustel.,Laulupidu. Reportaaž,muud,Yes,Positive
Viimastel aastatel on meie politsei saanud rahvusvahelist tunnustust erinevates valdkondades.,Euroopa narkoturg ei kahane,muud,Yes,Positive
Võimaliku vaenu õhutamise uurimiseks edastas kapo materjalid seisukoha võtuks Põhja politseiprefektuurile,Politsei Pravo i Pravda skandaalsest artiklist vaenu õhutamist ei leidnud,Ekspress Grupp,Yes,Neutral
"Võltsimistunnustega 500 kroonine kandis seerianumbrit BL427384, teatas Rapla politseijaoskonna infojuht Kaire Kozlova.",Politsei tuvastas Raplamaal kaks valeraha kasutamise juhtumit,Ekspress Grupp,Yes,Neutral
Võru politseiosakond teeb avalikku liiklusjärelevalvet ning mõõdab kiirust kella 10.00 - 12.00 Tallinna-Tartu-Luhamaa maanteel Võru-Põlva maakonna piirist kuni Viljandi ristmikuni.,Politsei mõõdab täna Tallinna-Tartu maanteel kiirust,Ekspress Grupp,Yes,Neutral