Text,Title,Publisher,Relevant,Stance
"Kaup tagastati kauplusele, politsei alustas mehe suhtes väärteomenetlust.",Politsei,muud,Yes,Neutral
Kella 16.15ks viib Kaitseliit koostöös politseiga võidutule Lüllemäele.,Võidupüha tähistamine Valgamaal,muud,Yes,Neutral
"Keskkonna järelevalve tõhustamiseks muretsetud ligi 12 miljonit krooni maksva Enstrom 480B tüüpi kopteri pärast käisid piirivalve lennusalga piloodid ja mehaanikud mullu sügisel ühendriikides koolitusel, kirjutab.",Keskkonnainspektsiooni kallis kopter seisis mitu kuud silmailuks,Ekspress Grupp,Yes,Neutral
"Keskkriminaalpolitsei pidas pikaajalise jälitustöö tulemusena 28. septembril Harjumaal ja Tallinnas kinni neli isikut, kellelt konfiskeeriti ligi 1,5 miljoni krooni ehk 30 000 doosi väärtuses amfetamiini.",Keskkriminaalpolitsei avastas Raasikul tegutsenud narkolabori,Ekspress Grupp,Yes,Neutral
"Kesklinna kriminaalpolitseinikud tegid kindlaks, et enamasti kasutati röövimiste käigus vägivalda, pekstes kannatanuid käte ja jalgadega.",Politsei sai kätte noorte vägivaldse röövlikamba,Ekspress Grupp,Yes,Neutral
"Kiiruseületajate karistamise ebaõnnestunud strateegiad on näidanud, et politsei ei ole suuteline tagama liiklusohutust.",Liiklusohutus teedel,muud,Yes,Negative
"Kohus andis eile loa kuni kuueks kuuks vahi alla jätta roolijoodiku, kes jäi politseile viiendat korda autoroolis purjuspäi vahele.",Mees tabati viiendat korda autoroolist purjuspäi,Ekspress Grupp,Yes,Neutral
"Kokku tekitas röövija kahju veidi alla 9500 krooni, teatas Põhja politseiprefektuur.",Politsei tabas Lasnamäe keldripoodide röövija,Ekspress Grupp,Yes,Neutral
"Korduvad juhtumid, kus politsei ei ole suutnud lahendada keerukaid kuritegusid, tekitavad küsimusi ametnike võimekuse kohta.",Lahendamata kuriteod kuhjuvad,muud,Yes,Negative
"Kui kehtiv asjaõigusseadus ütleb, et kaotatud asja leidja peab oma leiust politseile teatama, kui asja väärtus on üle 100 krooni, siis peatselt kerkib latt 50 euro ehk 780 kroonini.",Kuni 50-eurone asi saab leidja omaks,Ekspress Grupp,Yes,Neutral
"Kui röövid poode, hakkad politseile vastu, blokeerid liikluse või oled mässujuht, siis saad Ansipi ja Ilvese lubatud viie vangla-aasta asemel mõned tunnikesed üldkasulikku tööd, mõned kroonid trahvi või hullemal juhul tingimisi türmi",Rahatrahv pronksöö eest,Õhtuleht Kirjastus,Yes,Neutral
"Kuid siis ilmus nn 4. juuli memorandum kultuuritegelaste allkirjadega, mis pani politsei avalikkuse surve alla.",Sulev Luige mõrvamüsteerium,Õhtuleht Kirjastus,Yes,Neutral
"Kuigi 2005. koalitsiooni lepingusse oli sisse kirjutatud, et 66 meetri kõrgune piirivalve raadiomast tuleb mujale viia ei ole linnavõimud, seda teemat enam mõnda aega arutanud.",Ajaleht: Kuressaare piirivalvemasti linnast välja viimised idee on vaibunud,Ekspress Grupp,Yes,Neutral
"Kuigi varasematel aastatel on jäänud palju õppekohti täitmata, siis on piirivalvekolledži direktor kolonel Uno Kaskpeit sel aastal vägagi positiivselt meelestatud.",Piirivalvekolledž alustab uute õppurite vastuvõttu,Ekspress Grupp,Yes,Neutral
"Küllap seepärast ta mõistis, et politsei vajab tunnustamist, "" ütles Kürsa.",Kauplus tegi politseinikele kingituse,muud,Yes,Neutral
"Kuna asjale pole veel ametlikku käiku antud, siis politsei konfliktis osalenute nimesid ei avalda.",""" Ühel hetkel tõukas üks mees teise pikali ja hoidis teda kõrist kinni just nagu kägistades . """,Õhtuleht Kirjastus,Yes,Neutral
"Kurb on vaadata, kuidas politsei, kes on viimastel aastatel avaliku arvamuse küsitluste järgi üks enim usaldatud riigi institutsioone, kasutab järjest rohkem ebademokraatlike režiimidele omaseid jõuvõtteid.",Ärme luba politseil muutuda miilitsaks!,muud,Yes,Negative
"Lääne Politseiprefektuur teatas läinud neljapäeval firmast Plussmeister OÜ, mis tegeles fiktiivsete arvete välja saatmisega erinevatele asutustele mitmesuguste teenuste eest.","Ettevõte esitas 2,3 miljoni eest võltsarveid",Ekspress Grupp,Yes,Neutral
Läbipaistvuse puudumine politsei tegevuses on viinud avalikkuse usalduse vähenemiseni.,Usalduskriisid Eesti ametkondades,muud,Yes,Negative
"Lapsepilastaja Toomas H. Liiv tahab trellide taga abielluda naisega, kelle poega politsei tema võimaliku ohvrina üle kuulas.",Pedofiil Toomas H. Liiv kavandab vanglas pulmi,Ekspress Grupp,Yes,Neutral
Laupäeval kell 18.15 teatati häirekeskusest Lääne politsei-prefektuuri juhtimiskeskusele liiklusõnnetusest Raplamaal.,Rongiga kokku põrganud auto juht suri kohapeal,Ekspress Grupp,Yes,Neutral
Looduse rahu segavatest ATV-dest tuleks teatada keskkonnakaitsjaile või politseile.,ATV-dega lõbusõitu tegijad häirivad metsarahva rahu,Ekspress Grupp,Yes,Neutral
Lõuna prefektuuri tuvastas Tartumaal laupäeval kolme inimese surmaga lõppenud liiklusõnnetuse kolmanda hukkunu isiku.,Selgus Tartu liiklusavarii kolmanda hukkunu nimi,Ekspress Grupp,Yes,Neutral
"Lumiste kinnitas, et Kaitseliidu Valgamaa maleva arendamise jaoks oleks piirivalvelinnak suurepärane.",Kaitseliit kolib tõenäoliselt üle piirivalvelinnakusse,muud,Yes,Neutral
"Ma leian, et politsei maine üldse ei ole Eesti riigis halb.",Mis taastaks politsei maine?,muud,Yes,Positive
"Maainimene võib kohaliku konstaabli tööga rahule jääda, oleneb muidugi kohast.",Mis taastaks politsei maine?,muud,Yes,Positive
"Meeskond moodustub nii politseiameti kui ka julgestuspolitsei olemasolevatest kõrgel tasemel spetsialistidest, kes koondatakse uude talitusse.",Politseiamet moodustas uue kriminaal- ja korrakaitsetalituse,Ekspress Grupp,Yes,Neutral
"Mõne päeva möödudes informeeriti juhtunust politseid, kes alustas mehe kadumise asjaolude väljaselgitamist.",Politsei tabas joomakaaslase tapnud noormehe,Ekspress Grupp,Yes,Neutral
"Mõni tund hiljem tuli Paide politseijaoskonda 23-aastane Alar ning tunnistas, et oli Merzedes Benzi roolis.",Auto kummuli keeranud juht põgenes sündmuskohalt,Ekspress Grupp,Yes,Neutral
Möödunud reedel käisid mõlemad poisid politseile eraldi tunnistust andmas.,Alaealistele suitsu müünud müüjat võib oodata kopsakas rahatrahv,muud,Yes,Neutral
"Mustvee kordon on piirivalve jaoks ajalooline, kuna esialgselt ehitati see juba 1923. aastal.",Piirivalve saab Ida-Virumaal kaks uut kordonit,Ekspress Grupp,Yes,Neutral
"Muuhulgas on kavas maastikumängud, politseikooli külastamine, tutvumine politsei relvastuse ning erivahenditega.",Paide politseiring kasvatab noorte huvi politseitöö vastu,Ekspress Grupp,Yes,Neutral
"Nädalavahetusel hukkus liiklusõnnetustes neli inimest, teatas politseiamet.",Joobes autojuhid põhjustasid nädalavahetusel mitu ülirasket liiklusõnnetust,Ekspress Grupp,Yes,Neutral
"Narvas esitati politseile avaldus, milles vastselt juhiloa saanud naisterahvas kurdab, et tema endine sõiduõpetaja sõimas teda.",Kaheksane uudis: Narva sõiduõpetaja sõimas iseennast,Ekspress Grupp,Yes,Neutral
"Nii kadus 27. detsembri öösel Pikk 8a juurest Volkswagen Golf Variant, mille politseinikud leidsid E. Enno 1 maja hoovist.",Valgas tegutsevad autovargad,muud,Yes,Neutral
Nii rääkis maantee-ameti peadirektori asetäitja Harri Kuusk eile eravärvides politseiautosse paigaldatud radarkaamera esitlusel.,Pildistav radar tuvastab kiiruseületaja isiku,Ekspress Grupp,Yes,Neutral
"Ning e-riigist ei olda politseis justkui kuuldudki, kui Lõuna-Eestis elavat oma õiguste eest seisjat oldi valmis jooksutama ka Põhja- ja Lääne-Eesti politseiasutuste vahet.",Nimi rikub meest,Õhtuleht Kirjastus,Yes,Negative
"Novembri algul vahendas meedias, kuidas politseinikud üht maski mitte kandnud noort naist kaubanduskeskuse toidupoest välja tarisid.",Ärme luba politseil muutuda miilitsaks!,muud,Yes,Negative
Õhtul oli ta koos abipolitseinikega jälginud pidutsevate noorte tegemisi.,Noorukit löönud vallavanem: olen valmis ametist lahkuma,Ekspress Grupp,Yes,Neutral
Otsingusse kaasatud politseikoer Vedur leidis asjaosaliste suureks rõõmuks prouad pimedast metsast üles.,Tubli töö: politseikoer Vedur päästis metsast kaks eksinud prouat,muud,Yes,Positive
"Pärast seda sõlmiti küll töörahu, kuid erinevad prohmakad politseis viitavad mitmele puudusele, kus politseijuht peaks võtma vastutuse.",Politseijuhid ei kipu oma prohmakatele reageerima,muud,Yes,Negative
"Peipsi piirivalverajooni ülema kapten Illar Jõgi sõnul on Peipsil hetkel jää võrdlemisi tugev, kuid paiguti esineb niinimetatud hingamisauke.",Peipsil vajus traktor läbi jää,Ekspress Grupp,Yes,Neutral
Piirivalve ebakompetentsus on võimaldanud salakaubavedajatel Eesti territooriumile vabalt sisse ja välja liikuda.,Salakaubanduse väljakutsed Eestile,muud,Yes,Negative
"Piirivalve pidas kahtlase auto kinni 10. jaanuari hommikul, seejärel kontrollisid autot Lääne maksu- ja tollikeskuse liikuvrühma töötajad ning Pärnumaa keskkonnakaitseinspektorid.",Järelevalvetöötajad avastasid Iklas ebaseadusliku kalakoorma,Ekspress Grupp,Yes,Neutral
"Põhja politsei prefektuurist teatati Päevaleht Online'ile, et laamendajaks osutus 1987. aastal sündinud Oliver, kes praeguseks hetkeks on paigutatud arestimajja.",Purjus jalgpallifänn põhjustas kakluse,Ekspress Grupp,Yes,Neutral
"Põhja politseiprefektuur hakkas vanemprokurör Endla Ülviste ülesandel otsima inimest, kes lekitas infot Vilde tee kolmikmõrva kohta, kirjutab Postimees.",Prokuratuur jahib infoleket,Õhtuleht Kirjastus,Yes,Neutral
"Põhja politseiprefektuuri kriminaalosakonna varavastaste kuritegude talitus otsib 1980. aastal sündinud Andrei Selivanovit, kes hoiab kõrvale kriminaalmenetlusest.",Politsei palub abi võimaliku autovarga tabamisel,Ekspress Grupp,Yes,Neutral
"Põhjusel, miks näiteks narkopolitseinikud ei saa ajakirjanduses tutvustada narkokurjategijate tabamiseks vajalikke töövõtteid.",Aitäh politseile hea töö eest !,Õhtuleht Kirjastus,Yes,Neutral
"Politsei "" mustad "" nimekirjad kindlasti ei tee elu tulevikus kergemaks.",MIHHAIL STALNUHHIN: vene keel teise riigikeelena tundub halb nali,Ekspress Grupp,Yes,Neutral
"Politsei abistas laupäeval, 16. juunil inimesi, keda nende naabrimees ähvardas mängurelvaga.",Joobes mees hoidis naabreid mängurelvaga hirmu all,Ekspress Grupp,Yes,Neutral
"Politsei avas eile Tallinna vandalismiaktides osalenud isikute tuvastamiseks veebikeskkonna tuvasta.politsei.ee, kus on üleval pealtnägijate tehtud fotod rüüstamisel osalenud isikutest, ning pildikogu täieneb pidevalt.",Politsei palub vandaalide tuvastamiseks kaaskodanikelt vihjeid,Ekspress Grupp,Yes,Neutral
"Politsei kooskõlastas täna Tallinn Pride 2007 korraldajate veidi muudetud ja täiendatud liiklusskeemi, andes sellega loa geiparaadi toimumisele.",Politsei näitas geiparaadile rohelist tuld,Ekspress Grupp,Yes,Neutral
"Politsei leidis nooruki Rohu tänava ääres lumes lebamas, kirjutab Pärnu Postimees.",Pärnus vajas haiglaravi purjus ja alajahtunud teismeline,Ekspress Grupp,Yes,Neutral
"Politsei lõpetas rahvusraamatukogu ees jaanuaris peetud Keskerakonna vastase piketi asjaolude uurimise, sest teol puudusid väärteotunnused.",Politsei lõpetas Keskerakonna vastase piketi uurimise,Ekspress Grupp,Yes,Neutral
Politsei maine on madal ja on seda juba miilitsa ajast peale.,Mis taastaks politsei maine?,muud,Yes,Negative
"Politsei on edukalt lahendanud mitmeid kadunud isikute juhtumeid, kasutades selleks nii traditsioonilisi meetodeid kui ka kaasaegset tehnoloogiat.","Kadunud, kuid mitte unustatud",muud,Yes,Positive
"Politsei on viimasel ajal investeerinud rohkem ressursse küberkuritegude uurimisse, näidates silmapaistvaid tulemusi.",Küberjulgekolekust,muud,Yes,Positive
"Politsei on võtnud kasutusele uued meetodid, mis on osutunud vaid ajaliselt ja rahaliselt kulukaks, ilma et see tooks kaasa oodatud tulemusi.",Politsei innovatsioon või raiskamine?,muud,Yes,Negative
Politsei otsus kasutada meeleavaldustel ülemäärast jõudu on toonud kaasa inimõiguste rikkumise süüdistused.,Meeleavalduste korraldamise dilemmad,muud,Yes,Negative
"Politsei pidas kohapeal kinni kolm alaealist noormeest, kellega politsei edasi tegeleb.",Politsei,muud,Yes,Neutral
"Politsei pidas sõiduauto kinni, selle roolis oli alkoholijoobes Irina ( snd 1962 ).",Politsei,muud,Yes,Neutral
"Politsei sisemised vaidlused ja juhtimisprobleemid on tõstatanud küsimusi, kas asutus on võimeline täitma oma kohustusi.",Politsei juhtimisküsimused,muud,Yes,Negative
"Politsei sõitis sündmuskohale ja leidis eest avatud ustega garaaži, kust oli turvafirma teatel kadunud madelauto Volkswagen Transporter.",Valgast varastatud auto leiti Tõlliste vallas kraavist,muud,Yes,Neutral
"Politsei soovib teha omalt poolt kõik, et inimeste jõuluaeg kujuneks turvaliseks, "" ütles politseipeadirektor Raivo Aeg. "" Selle ülesande täitmiseks kavandavad politseiasutused täiendavaid tegevusi. """,Politsei tõhustab detsembris avaliku korra tagamist,muud,Yes,Positive
"Politsei teatel oli hukkunud autojuhil turvavöö kinni, tema võimalik joove selgitatakse välja ekpertiisi tulemusena.",Pärnumaal hukkus mootorratta ja auto kokkupõrkes autojuht,Ekspress Grupp,Yes,Neutral
"Politsei toimetab 4000-5000 korda aastas kinnipidamiskambrisse välja puhkama mõne joobes või meelemürke tarvitanud inimese, keda tänaval ohustaksid kurjategijad või alajahtumine.",Linn rajab medabi pakkuva kaineri,Ekspress Grupp,Yes,Neutral
"Politsei toimetas naise surnukeha ekspertiisi, kus selgub hukkunu isik.",Kalamees leidis jõest naise surnukeha,Ekspress Grupp,Yes,Neutral
Politseiameti teatel leiti 31. detsembril kella 11.22 ajal Narvas Puškini tänava majast Anatoli ( s 1950 ) noahaavaga surnukeha.,Aastavahetusel tapeti Narvas kaks meest,Ekspress Grupp,Yes,Neutral
"Politseidirektor Toomas Malva tegi eile hommikul ETV "" Terevisioonis "" avalduse, et 9. mail pole vahet, kas lehvitatakse punalippu või sinimustvalget lippu - ühteviisi provokatiivsed on mõlemad tegevused.",REPLIIK: On ikka vahe küll,Ekspress Grupp,Yes,Neutral
"Politseile teatati eile kell 10.55, et Järva maakonnas Koigi vallas Päinurme külas sõidab ümber koolihoone sõiduauto pidevalt signaali andes.",Purjus isa pani teismelise poja rooli,Ekspress Grupp,Yes,Neutral
"Politseinik rääkis kolleegiga, kes juristi juhiluba väärteomenetluse läbiviimiseks edasi ei andnud, ning sai pakutavast 8000-kroonisest altkäemaksust teada, seisab süüdistuses.",Endine advokaat läheb kohtu alla,Ekspress Grupp,Yes,Neutral
Poole aastaga kuulutas politsei toona kadunuks 86 ja üles leiti 93 varem teadmata kadunuks kuulutatud inimest.,513 peret Eestis ootavad koju teadmata kadunud lähedasi,Ekspress Grupp,Yes,Neutral
PPA hiljutine ettevõtmine koolides liiklusohutuse teemadel on saanud laialdast positiivset tagasisidet.,Politsei käis koolis liiklusohutus õpetamas,muud,Yes,Positive
"PPA on tõhusalt lahendanud mitmed rasked kuriteod, mida iseloomustavad keerulised asjaolud.",Kuritegude statistika,muud,Yes,Positive
Praegu kogub politsei toimunu kohta materjali ning kaalub väärteomenetluse alustamist.,TTÜ ühikapeole kutsuti mitmel korral politsei,Ekspress Grupp,Yes,Neutral
"Praegu lõpeb aga politsei tegevus pahatihti vaid kuriteofaktide registreerimisega ja kui ise otsima ei hakka, ei tee politsei kah midagi.",Mis taastaks politsei maine?,muud,Yes,Negative
Praegune politsei on inimeste turvalisust moraalses plaanis suuresti parandanud.,Mis taastaks politsei maine?,muud,Yes,Positive
"Praeguseks on prokuratuur algatanud 19 kriminaalasja nii avaliku korra raske rikkumise, varguste kui ka politseile vastuhakkamise tõttu.",Raskema rikkumisega astub kohtu ette 19 isikut,Ekspress Grupp,Yes,Neutral
"Praeguseks on Tallinna munitsipaalpolitseinikud teinud juba ligi 500 müügikeelu kontrollkäiku, märkus on tulnud teha 12 kaupmehele.",Alkoholikeeldu kontrollib Tallinnas munitsipaalpolitsei,Ekspress Grupp,Yes,Neutral
"Reede pärastlõunal teatas Gitta Nazarova juhtunust politseile, kes alustas vahejuhtumi info kogumist.",Tundmatu üritas keset päeva kesklinnas väikelast röövida,Ekspress Grupp,Yes,Neutral
"Ressursside raiskamine on politseiorganisatsioonis muutumas üha tavalisemaks, eriti luksuslike töövahendite soetamisel.",Kuhu läheb politsei raha?,muud,Yes,Negative
"Riigikogu liige väitis, et hiljutised protestid on toonud esile politsei puuduliku ettevalmistuse suurte rahvakogunemiste ohjamiseks.",Massiürituste korraldamise puudujäägid annavad tunda,muud,Yes,Negative
Sealne liikluspolitsei koosnebki peaasjalikult hallipäistest soliidsetest härrasmeestest.,"Villu Vane – ilusat pensioni ! A natuke noor ei ole veel ? Üks politseinik , kelle vastu respekt !",Õhtuleht Kirjastus,Yes,Neutral
"Seda naeratust ei suuda Jäärats enam endas hoida ja et emotsioon ei paistaks võidurõõmuna, saab naeratusest kiiresti grimass, kuid see on ka kõik, millega narkopolitseinik oma emotsioone reedab.",Narkokomissar Jäärats astus kohtust välja vaba mehena,Ekspress Grupp,Yes,Neutral
Sedavõrd suurt hulka joobes juhte ei ole ühe hommikuse ___politsei___operatsiooni käigus tükk aega tabatud.,Rapla politsei tabas täna hommikul seitse joobes juhti,Ekspress Grupp,Yes,Neutral
"See algas tänavu aprillis, kui Tallinnas toimunud rahumeelsete inimeste valitsusvastaseid meeleavaldusi käisid maha surumas politsei eriüksuslased, politseinikud, kellel oli nimesiltide asemel number (et neid ei oleks võimalik tuvastada) ja kes on saanud eriväljaõppe massirahutuste mahasurumiseks.",Ärme luba politseil muutuda miilitsaks!,muud,Yes,Negative
"See omakorda on sundinud valitsust varasemaid lubadusi tagasi võtma ning kõneks olnud palgatõusust ilma jäävaid õpetajaid, politseinikke ja meedikuid meelt avaldama.",Kalvitis: pessimistlikud ennustused said tõeks,Ekspress Grupp,Yes,Neutral
"Seepärast ei jäänud politseinikel muud üle, kui vormistasid Andreile väärteoprotokolli ja lasid ta vabadusse.",Müüjat tappa ähvardanud poevaras jäi vabadusse,Ekspress Grupp,Yes,Neutral
"Selle käsu loogika oli lihtne: madalad trahvid pole liiklejaid seni distsiplineerinud, kõrgemad trahvid peaksid siis mõjuma, ning politsei täidabki usinalt ministri korraldust.",KÄRT ANVELT: Ettevaatust - Eesti politsei,Ekspress Grupp,Yes,Neutral
Selle sündmuse pealtnägijatelt ootab politsei kõnesid telefonil 730 8648.,Tartu politsei palub liiklusõnnetuse pealtnägijate abi,Ekspress Grupp,Yes,Neutral
Selleks sõlmis vald MTÜ-ga lepingu ja hiljem ka abipolitseiniku tunnistused omandanud ühingu liikmed asusid kohalike firmade rahalisel toetusel põhikohaga korrakaitsjatena tööle.,Politsei surve tegi kahe valla omaalgatusele lõpu,Ekspress Grupp,Yes,Neutral
"Seni alustatud kriminaalmenetlustest käsitlevad seitse politseipoolset põhjendamatut vägivalda ning ühe menetluse raames kontrollib prokuratuur väiteid, kas politseinik võis omastada kannatanu mobiiltelefoni.",Politsei tegevuse uurimiseks rahutuste ajal on alustatud kaheksa kriminaalmenetlust,Ekspress Grupp,Yes,Negative
Seoses uue juhtkonna tulekuga on viimase poole aasta jooksul politseis toimunud märgatav nihe paremuse poole.,Mis taastaks politsei maine?,muud,Yes,Positive
"Siseminister Jüri Pihl tegi pärast liiklusõnnetuste statistika analüüsimist otsuse, et liiklusõnnetustes hukkunute arvu vähendamiseks tuleb alustada politsei jõulisest reageerimisest.",Pihl: politsei peab karmistama liiklusrikkumiste karistusi,Ekspress Grupp,Yes,Neutral
Sügisel ja detsembris harjutasid Valga ja Valka politseinikud piiriülest koostööd.,Koostööleping aitab muuta piiriäärsete elanike elu,muud,Yes,Neutral
"Tallinna volikogu aseesimehe Elmar Sepa jalgealune on tuline, kuna vanalinna korterite tuttavate ja sõprade kätte mängimises kahtlustamise tõttu ootab teda ees nii umbusaldamine volikogus kui ka võimalik politseiuurimine.",Oma kutsumuse ohver: Elmar Sepa elutöö on korteriskandaalid,Ekspress Grupp,Yes,Neutral
Täna alustab Valgas ja Valkas lisaks tavapatrullidele tööd Eesti ja Läti politsei ühispatrull.,Politsei ühispatrull alustab,muud,Yes,Neutral
"Täna kella 21.40 oli politsei sunnitud kasutama Tõnismäel avaliku korra kaitsmiseks veelkord erivahendeid, kui toimus uus rünnak politseinike vastu.",Politsei kasutas valgus- ja heligranaate ning pulberkustuteid,Ekspress Grupp,Yes,Neutral
"Täna kella viie ajal õhtul juhtus liiklusõnnetus Puhja vallas Tartu-Viljandi maantee 13. kilomeetril, kus põrkasid kokku vastassuunavööndisse kaldunud kaubik Ford Transit ja sõiduauto VAZ 21063, teatas Lõuna politseiprefektuur.",Tartumaal hukkus liiklusõnnetuses kaks inimest,Ekspress Grupp,Yes,Neutral
"Täna Olümpia hotellis alanud konverents "" Kaitseme eurot võltsimise eest! "" tõi neljaks päevaks Eestisse kokku politseinikke, pankureid ja salateenistuse spetsialiste nii Euroopast kui Ameerikast.",Valerahategijad ootavad euro tulekut,Ekspress Grupp,Yes,Neutral
"Täna öösel pidasid Lääne Piirivalvepiirkonna Ikla piirivalvekordoni piirivalvurid kinni tagaotsitava isiku, kes anti üle Läti piirivalve esindajale.",Piirivalvurid pidasid Läti päti kinni,Ekspress Grupp,Yes,Neutral
"Täna võisteldakse Valgamaal Sokka turismitalus politseitöös vajalike õigusaktide tundmises, konfliktsituatsiooni lahendamises, liiklusõnnetuse sündmuskoha korrektses fikseerimises ning ennetusalase sisuga avalikus esinemises.",Küsimus-vastus,muud,Yes,Neutral
Tänu piirivalve kiirele reageerimisele avastati ja peatati mitu salakaubavedajate katset.,Piirivalve tõhustab järelevalvet,muud,Yes,Positive
"Tartu politseiosakonna pressiesindaja teatel selgus, et omavahelise arveteklaarimise käigus oli kaupluses löömaks läinud.",Tartus läks kaupluses löömaks,Ekspress Grupp,Yes,Neutral
"Tartus juhtus öösel liiklusõnnetus, kus purjus rollerijuht rammis politseiautot, tegemist on juba teise sarnase õnnetusega ööpäeva jooksul.",Roolijoodik rammis jälle politseiautot,Ekspress Grupp,Yes,Neutral
"Tartus teatas taksojuht esmaspäeval politseile, et tema sõidukis on relvaga klient.",Relvastatud mees istus taksosse,Õhtuleht Kirjastus,Yes,Neutral
"Teises maailmasõjas langenute mälestussamba juures peetud miiting eile Haapsalus oli emotsioonidelt vaoshoitud, rahva kogunemist jälgis/turvas tavapärasest rohkem politseinikke ja abipolitseinikke.",Võidumiiting hoidus poliitikast,muud,Yes,Neutral
"Teisipäeva hommikul kell 8.05 teatati politseile, et Valgas Vabaduse tänaval juhtus liiklusõnnetus.",Valga kesklinnas autolt löögi saanud naine suri,muud,Yes,Neutral
Temale teadaolevalt oli eile pärastlõunal Tallinnas Mustamäel asuvasse tagalapataljoni olukorda kontrollima saadetud ka sõjaväepolitsei.,Tagalapataljoni rühm pandi vanematega kohtuma maskides,Ekspress Grupp,Yes,Neutral
Toila lähistel asuva reostuse likvideerimiseks on piirivalve käivitanud reostustõrje operatsiooni.,Piirivalve avastas kaks merereostust,Ekspress Grupp,Yes,Neutral
"Tööd jätkus veepolitseile ka järgnevatel päevadel, kui nii laupäeval kui ka pühapäeval tabati joobes väikelaevajuht.",Pärnu veepolitsei tabas kaks purjus laevajuhti,Ekspress Grupp,Yes,Neutral
Tublid politseikoerad on oluliselt parandanud narkootikumide avastamise määra.,Koerad narkorindel,muud,Yes,Positive
"Tuleb nentida, et politsei on viimasel ajal teinud edukat tõhusalt koostööd teiste Euroopa Liidu liikmesriikide politseijõudude ja piirivalve üksustega.",Piiritud piirikriisid,muud,Yes,Positive
"Tulest pääses kaks meest, kustutamisel leidsid päästjad hukkunu, kes Ida politseiprefektuuri pressiesindaja teatel oli 1940. aastal sündinud Fjodor.",Põlenud puukuurist leiti hukkunu,Õhtuleht Kirjastus,Yes,Neutral
"Ühe suurima muudatusena viidi sisse asendus, mis andis õiguse teha ettekirjutisi mitte enam siseministrile, vaid hoopis politsei prefektile, kes on Linde sõnul tunduvalt apoliitilisem.",Keelatud rajatiste eelnõu läbis teise lugemise,Ekspress Grupp,Yes,Neutral
"Üks seifidest oli tühi, kuid teises sularaha ligi 100 000 krooni väärtuses ja kiirloteriipileteid, ütles Lõuna politseprefektuuri pressiesindaja Kairi Patlep Päevaleht Online'ile.",Tõrva kauplusest varastati ligi 100 000 krooni,Ekspress Grupp,Yes,Neutral
"Üldise ebaviisakuse kasv politseinike hulgas on tekitanud avalikkuses küsimusi, kas ametnikud peaksid läbima täiendava eetikakoolituse.",Kas politsei on liiga karm?,muud,Yes,Negative
"Uued politseiüksused, mis on saanud kallid investeeringud, ei ole suutnud näidata olulisi tulemusi.",Kas uued politseiüksused on oma hinda väärt?,muud,Yes,Negative
Uued turvameetmed piiril on osutunud ebaefektiivseks ja on saanud osa ekspertide poolt kriitikat.,Piirivalve tõhususest,muud,Yes,Negative
"Vahel on käinud politseinikud lasteaias ja lastele nad tohutult meeldivad, nad oskavad väga hästi läheneda ja kenasti käituda.",Mis taastaks politsei maine?,muud,Yes,Positive
"Vähem tähelepanu on saanud juhtumid, kus politsei on kasutanud jõudu ebaproportsionaalselt, põhjustades sellega kodanike vigastusi.",Politsei ja jõu kasutamise küsimus,muud,Yes,Negative
Valga politseijaoskond sai ühe politseibussi Volkswagen Transporter ja kaks sõiduautot Suzuki Vitara.,Politsei autopark noorenes,muud,Yes,Neutral
"Valga preventsioonitalitus koos Valga konstaablijaoskonnaga viis 21. septembril Valgas ja Tsirguliinas läbi politseioperatsiooni, mille eesmärgiks oli tõkestada alaealiste õigusrikkumisi ja tagada avalikku korda.",Politsei,muud,Yes,Neutral
Vastavasisuliste taotlustega on Lootsmanni poole pöördunud mitmed maakonna omavalitsused ja Põhja politseiprefekt Raivo Küüt.,Harju maavanem kaalub alkoholimüügi piiramist suveperioodiks,Ekspress Grupp,Yes,Neutral
"Vigastatutest ja arreteeritutest esialgseid teateid ei ole, küll aga toimusid väiksemad kokkupõrked kloostri läheduses, politsei pani ajalehe teatel suurematele teedele välja kontrollpunktid.",Dalai-laamale antud auhind põhjustas Tiibetis politsei ja munkade kokkupõrke,Ekspress Grupp,Yes,Neutral
